{
  "set_id": "mb-cls-ulysses-v1",
  "categories": [
    "supports",
    "contradicts",
    "qualifies",
    "contextualizes"
  ],
  "criteria_version": "mb-cls-criteria-v2",
  "criteria_locked_at": "2026-08-01T21:30:00Z",
  "criteria_lock_content_hash": "sha256:f20a1cb8674b41b61bc9b790537412b19056dc25d47df20923c4e5d03f31e780",
  "criteria": {
    "supports": "The excerpt asserts, from the source's OWN evidence or its own system's behaviour, that the claim holds: some verification step exists and is separate from the component whose output it checks. A general assertion, not one fenced to a named subset.",
    "contradicts": "The excerpt asserts, from the source's OWN evidence, that the claim does not hold: either no verification step exists, or the checking is performed by the same component (or the same model, or the same process) that produced the output. Self-review counts as contradicting, because the claim is about independence, not about the existence of review.",
    "qualifies": "The excerpt neither asserts nor denies the claim in general, but narrows it: it holds for a named subset (some outputs, some stages, some configuration), or under a stated condition, or only as far as the source's own evidence reaches. A finding hedged to its own test conditions belongs here.",
    "contextualizes": "The excerpt bears on the subject matter but takes no position on the claim: a definition, a background measurement, a count, a description of the field, or a statement about something adjacent."
  },
  "labelled_at": "2026-08-01T20:52:00Z",
  "label_provenance": {
    "producing_practice": "ulysses",
    "account": "Labelled blind by the Ulysses practice on 2026-08-01 against mb-cls-criteria-v2 as delivered, from the sixty excerpts in commission.v2.json and nothing else; no access to the classifications being measured. Study record and the frame used: projects/2026-08-01-sixty-cases-blind/ in the Ulysses repository.",
    "encounter_id": null,
    "blind_to_measured_labels": true
  },
  "notes": "Produced blind: the labeller had no access to the classifications being measured, and the commission file it read carries no labels (verified — the union of case keys is case_id, claim_text, excerpt, excerpt_sha256, source_identifiers, source_url, title). Reading applied: an excerpt engages the claim when the source's own evidence says whether an automating system's outputs are checked by something other than the component that produced them. Engaged, general, separate checker -> supports; engaged, checker is the same model, component or process (or absent) -> contradicts; engaged but fenced to a stage, a domain outside the research cycle, a configuration or the reach of the source's own tests -> qualifies; no checking arrangement of the source's own system reported (survey, taxonomy, infrastructure proposal, vision without a system, or a benchmark measuring some other property) -> contextualizes. Three asymmetries in the criteria were applied as written rather than smoothed, and are argued in the return letter: (a) `supports` carries a generality fence and `contradicts` carries none, so a fenced self-review contradicts while a fenced independent check only qualifies; (b) that fence, met by a corpus in which every paper fences its evidence to its own benchmark, leaves `supports` nearly empty — one case in sixty; (c) the tie-break runs only between supports and qualifies, so a case torn between contradicts and qualifies has no cell and leaves no trace. These labels are not a human gold standard. They were made by a machine practice with the same responsible human as the commissioning practice, which is a limitation of the exercise and not a footnote to it. Disagreements should be recorded per case and argued against the rationales, not averaged.",
  "cases": [
    {
      "case_id": "mbcls-2205.08794",
      "excerpt": "We present LogiGAN, an unsupervised adversarial pre-training framework for improving logical reasoning abilities of language models. Upon automatic identifying logical reasoning phenomena in massive text corpus via detection heuristics, we train language models to predict the masked-out logical statements. Inspired by the facilitation effect of reflective thinking in human learning, we analogically simulate the learning-thinking process with an adversarial Generator-Verifier architecture to assist logic learning. LogiGAN implements a novel sequential GAN approach that (a) circumvents the non-differentiable challenge of the sequential GAN by leveraging the Generator as a sentence-level generative likelihood scorer with a learning objective of reaching scoring consensus with the Verifier; (b) is computationally feasible for large-scale pre-training with arbitrary target length. Both base and large size language models pre-trained with LogiGAN demonstrate obvious performance improvement on 12 datasets requiring general reasoning abilities, revealing the fundamental role of logic in broad reasoning, as well as the effectiveness of LogiGAN. Ablation studies on LogiGAN components reveal the relative orthogonality between linguistic and logic abilities and suggest that reflective thinking's facilitation effect might also generalize to machine learning.",
      "excerpt_sha256": "sha256:0a3e9b599ce714e53ac793ea3de888df1788de31857f780face28087d0c06416",
      "source_identifiers": {
        "doi": null,
        "repository_id": "2205.08794",
        "archive_id": null,
        "local_asset_id": "mbcls-2205.08794"
      },
      "claim_text": "Systems that automate the research cycle end to end verify their own outputs independently of the component that produced them.",
      "decided_by": "qualifies definition",
      "tie_with": null,
      "expected_relation": "qualifies",
      "expected_rationale": "A Verifier separate from the Generator scores the generator's output, but the source's evidence reaches only logical-reasoning pre-training of language models and no stage of a research cycle, so the claim is narrowed rather than asserted.",
      "undecidable": false,
      "undecidable_reason": null
    },
    {
      "case_id": "mbcls-2402.00559",
      "excerpt": "Prompting language models to provide step-by-step answers (e.g., \"Chain-of-Thought\") is the prominent approach for complex reasoning tasks, where more accurate reasoning chains typically improve downstream task performance. Recent literature discusses automatic methods to verify reasoning to evaluate and improve their correctness. However, no fine-grained step-level datasets are available to enable thorough evaluation of such verification methods, hindering progress in this direction. We introduce REVEAL: Reasoning Verification Evaluation, a dataset to benchmark automatic verifiers of complex Chain-of-Thought reasoning in open-domain question-answering settings. REVEAL includes comprehensive labels for the relevance, attribution to evidence passages, and logical correctness of each reasoning step in a language model's answer, across a variety of datasets and state-of-the-art language models. Evaluation on REVEAL shows that verifiers struggle at verifying reasoning chains - in particular, verifying logical correctness and detecting contradictions. Available at https://reveal-dataset.github.io/ .",
      "excerpt_sha256": "sha256:c426bad242ef7f2dc56017bc5f9791e6dfac7f3f36679b25c0cc0302181fe0b9",
      "source_identifiers": {
        "doi": null,
        "repository_id": "2402.00559",
        "archive_id": null,
        "local_asset_id": "mbcls-2402.00559"
      },
      "claim_text": "Systems that automate the research cycle end to end verify their own outputs independently of the component that produced them.",
      "decided_by": "contextualizes definition",
      "tie_with": null,
      "expected_relation": "contextualizes",
      "expected_rationale": "The source builds a benchmark measuring how well automatic verifiers judge reasoning chains, which bears on verification quality but takes no position on whether an automating system's checker is separate from its producer.",
      "undecidable": false,
      "undecidable_reason": null
    },
    {
      "case_id": "mbcls-2407.00466",